{
  "schema_version": 1,
  "contract_type": "qsre-to-pde",
  "contract_version": "1.0.0",
  "feedback_id": "QF-DEMO-001",
  "created_at": "2026-09-20T15:00:00Z",
  "outcome_id": "OUT-DEMO-001",
  "pack": {"repository": "https://github.com/example/pde-environment", "commit_sha": "1111111111111111111111111111111111111111", "path": "workspaces/projects/demo/outcomes/OUT-DEMO-001/pack.json", "version": "1.0.0"},
  "implementation": {"repository": "https://github.com/example/product-repository", "commit_sha": "2222222222222222222222222222222222222222", "path": "src"},
  "feedback_type": "clarification",
  "severity": "minor",
  "observation": {"summary": "Условия измерения результата требуют дополнительного уточнения до выпуска", "observed_at": "2026-09-20T14:45:00Z", "environment": "test"},
  "affected_identifiers": ["NFR-001", "SLICE-DEMO-001"],
  "evidence": [{"evidence_id": "EVD-002", "reference": {"repository": "https://github.com/example/product-repository", "commit_sha": "2222222222222222222222222222222222222222", "path": "evidence/OUT-DEMO-001/performance.json"}, "summary": "Результат теста не фиксирует согласованное окно наблюдения"}],
  "required_decision": {"summary": "Уточнить окно измерения и подтвердить применимость результата", "due_at": "2026-09-21T12:00:00Z", "release_impact": "review-required"},
  "qsre_owner": "Владелец QSRE",
  "pde_response": {"status": "pending"}
}
